{
  "$schema": "https://json-schema.org/draft/2020-12/schema",
  "type": "object",
  "properties": {
    "id": {
      "type": "string",
      "pattern": "^[a-z0-9]+(?:_[a-z0-9]+)*$"
    },
    "name": {
      "type": "string"
    },
    "description": {
      "type": "string"
    },
    "icon": {
      "type": "string"
    },
    "military": {
      "default": false,
      "type": "boolean"
    },
    "techs": {
      "minItems": 1,
      "type": "array",
      "items": {
        "type": "object",
        "properties": {
          "id": {
            "type": "string",
            "pattern": "^[a-z0-9]+(?:_[a-z0-9]+)*$"
          },
          "name": {
            "type": "string",
            "minLength": 1
          },
          "description": {
            "type": "string",
            "minLength": 1
          },
          "year": {
            "type": "integer",
            "minimum": 1980,
            "maximum": 2060
          },
          "cost": {
            "default": 180,
            "type": "number",
            "exclusiveMinimum": 0
          },
          "prerequisites": {
            "default": [],
            "type": "array",
            "items": {
              "minItems": 1,
              "type": "array",
              "items": {
                "type": "string",
                "pattern": "^[a-z0-9]+(?:_[a-z0-9]+)*$"
              }
            }
          },
          "mutually_exclusive": {
            "default": [],
            "type": "array",
            "items": {
              "type": "string",
              "pattern": "^[a-z0-9]+(?:_[a-z0-9]+)*$"
            }
          },
          "icon": {
            "type": "string"
          },
          "x": {
            "type": "integer",
            "minimum": 0,
            "maximum": 9007199254740991
          },
          "effects": {
            "default": {},
            "type": "object",
            "propertyNames": {
              "type": "string",
              "pattern": "^[a-z0-9]+(?:_[a-z0-9]+)*$"
            },
            "additionalProperties": {
              "type": "number"
            }
          }
        },
        "required": [
          "id",
          "name",
          "description",
          "year",
          "x"
        ],
        "additionalProperties": false
      }
    }
  },
  "required": [
    "id",
    "name",
    "description",
    "techs"
  ],
  "additionalProperties": false
}
